capitulo,pregunta,respuesta,a,b,c,d,e
c09,¿Qué valor moral se opone a toda forma de discriminación?,e,Justicia,Libertad,Dignidad,Solidaridad,Igualdad
c09,¿Quiénes son considerados personas amorales?,a,Infantes y dementes,Políticos,Filósofos,Científicos,Extranjeros
c09,¿Qué es el "deber" según el texto?,c,Una ley impuesta por la fuerza,Un sentimiento de placer,La obligación de realizar lo bueno por criterio propio,Una regla técnica,Una norma jurídica
c09,La justicia distributiva exige:,d,Devolver favores,Imponer castigos físicos,Ignorar a la sociedad,Equidad social al distribuir bienes,Venganza personal
c09,La ética de la resignación es propia del:,b,Hedonismo,Estoicismo,Eudemonismo,Utilitarismo,Existencialismo
c09,Según Sócrates, el mal es producto de la:,e,Razón,Virtud,Felicidad,Ciencia,Ignorancia
c10,¿Qué significa etimológicamente "mythos"?,a,Relato o narración,Razón o discurso,Costumbre o hábito,Ciencia o saber,Valor o mérito
c10,¿Cuál es la finalidad primordial del mito?,b,Científica,Psicológica (dar sentido a la vida),Económica,Política,Matemática
c10,Los mitos que relatan cómo se creó el mundo se llaman:,c,Teogónicos,Escatológicos,Cosmogónicos,Morales,Heroicos
c10,¿Qué clase de mito explica el origen del bien y del mal?,d,Cosmogónico,Teogónico,Escatológico,Moral,Etiológico
c10,La creencia en un solo Dios se denomina:,e,Animatismo,Politeísmo,Panteísmo,Ateísmo,Monoteísmo
c10,¿Qué diferencia principalmente a la ciencia del mito?,a,Eficacia y verificabilidad,Imaginación y fe,Narración y fantasía,Tradición y autoridad,Miedo y esperanza
c10,¿Dónde surgió la filosofía occidental?,c,Atenas,Esparta,Mileto,Roma,Alejandría
c10,¿Quién es considerado el primer filósofo de la historia?,b,Sócrates,Thales de Mileto,Pitágoras,Platón,Aristóteles
c10,¿Quién fue el primero en llamarse a sí mismo "filósofo"?,d,Anaximandro,Heráclito,Parménides,Pitágoras,Demócrito
c10,¿Qué condición estructural permitió el ocio para filosofar en Grecia?,a,El modo de producción esclavista,La falta de comercio,La guerra constante,La ausencia de leyes,El clima frío
c10,La polis griega fue importante para la filosofía porque fue centro de:,e,Silencio,Combate físico,Sacrificios,Agricultura,Discusión y uso de la palabra
c10,El paso del "mito al logos" significa el paso a la:,b,Imaginación,Razón,Religión,Fantasía,Poesía
c10,El mito de Inkarri es un ejemplo de resistencia en:,c,Grecia,Egipto,Época colonial indígena,Roma,India
c10,Los mitos que cuentan el fin del mundo son:,d,Cosmogónicos,Teogónicos,Morales,Escatológicos,Científicos
c10,¿Qué es el animatismo?,a,Creencia en divinidad de fuerzas naturales,Creencia en muchos dioses humanos,Creencia en un Dios espiritual único,Negación de los dioses,Estudio de los animales
c10,¿Qué relaciona al mito con la ciencia?,b,El método deductivo,La intencionalidad de explicar el mundo,La prueba de laboratorio,El uso de fórmulas,La falta de interés
c10,¿En qué siglos surgió la filosofía occidental?,e,I y II d.C.,XV y XVI d.C.,X y XI a.C.,III y IV a.C.,VII y VI a. n. e.
c10,Thales de Mileto fue fundador de la escuela:,c,Pitagórica,Sofista,Jónica,Eleática,Estoica
c10,¿Qué permite el progreso de la ciencia según el anarquismo epistemológico (visto en c07 pero relacionado aquí)?,a,Violación de las normas del método,Seguir fielmente a los dioses,Usar solo la fe,Evitar la razón,No investigar
c10,La filosofía surge cuando los mitos pierden:,d,Belleza,Antigüedad,Idioma,Fuerza explicativa y credibilidad,Color